{"expires_at":"2026-09-19T00:00:00Z","generated_at":"2026-08-20T00:00:00Z","products":[{"aliases":["demo"],"default_distribution":"example/demo","display_name":"Demo","distributions":[{"id":"example/demo","kind":"upstream","releases":[{"components":["mcp"],"distribution_id":"example/demo","manifest_digest":"sha256:2222222222222222222222222222222222222222222222222222222222222222","package_source":{"path":"plugins/demo","repository":"example/plugins","revision":"aaaaaaaaaaaaaaaaaaaaaaaaaaaaaaaaaaaaaaaa"},"package_version":"1.0.0","policy":{"compatible_clients":["codex","cursor"],"current_evidence":[{"architecture":"amd64","client":"codex","client_version":"0.200.0","digest":"sha256:3333333333333333333333333333333333333333333333333333333333333333","evidence_id":"runtime-demo-codex","installer_version":"0.1.6","level":"runtime","observed_at":"2026-08-19T00:00:00Z","os":"linux","outcome":"passed"}],"minimum_installer_version":"0.1.6","release_sequence":2,"scopes":["user"],"status":"active"},"published_at":"2026-08-01T00:00:00Z","sequence":2,"tree_digest":"sha256:1111111111111111111111111111111111111111111111111111111111111111"}],"status":"active"},{"id":"example/demo-bridge","kind":"community_bridge","releases":[{"build_provenance":{"upstream_repository":"example/plugins","upstream_revision":"cccccccccccccccccccccccccccccccccccccccc"},"components":["mcp"],"distribution_id":"example/demo-bridge","manifest_digest":"sha256:5555555555555555555555555555555555555555555555555555555555555555","package_source":{"path":"plugins/demo","repository":"example/bridge","revision":"bbbbbbbbbbbbbbbbbbbbbbbbbbbbbbbbbbbbbbbb"},"package_version":"0.9.0","policy":{"compatible_clients":["codex"],"current_evidence":[],"release_sequence":1,"scopes":["user"],"status":"revoked"},"published_at":"2026-07-01T00:00:00Z","sequence":1,"tree_digest":"sha256:4444444444444444444444444444444444444444444444444444444444444444"}],"status":"suspended"}],"id":"demo","manifest_name":"demo"}],"publication_id":"fixture-1","sequence":7,"snapshot_schema_version":1,"source_commit":"dddddddddddddddddddddddddddddddddddddddd"}
